{
  "id": "967ce171-572c-43e1-a4a5-37da28491656",
  "name": "Luke Reddington",
  "aliases": [],
  "position": "DEF",
  "ability": "sunday_league",
  "vet": "none",
  "rating_override": null,
  "fitness": "moderate",
  "profile": "Also covers midfield. Average player. Not much known yet, he has not played much.",
  "created_at": "2026-08-20",
  "updated_at": "2026-08-20",
  "preferred_positions": [
    "CB",
    "CM"
  ],
  "workrate": "steady"
}
