{
  "id": "3e75cc48-26e8-4114-8516-f09bbf324897",
  "name": "David Pugh",
  "aliases": [
    "Pugh"
  ],
  "position": "DEF",
  "preferred_positions": [
    "CB"
  ],
  "negative_positions": [
    "ST",
    "CAM"
  ],
  "ability": "recreational",
  "vet": "none",
  "rating_override": null,
  "fitness": "moderate",
  "profile": "Luke Reddington's +1, a centre back. Harry rated him as not great but able to play. Watched properly on 27 August 2026 and he sits below mid-table in this group rather than in it \u2014 dropped to 4. Share a surname or initial when naming him, since David Potter is also in the squad.",
  "created_at": "2026-08-20",
  "updated_at": "2026-08-28",
  "workrate": "steady",
  "ability_value": 3.75,
  "fitness_value": 5.0,
  "workrate_value": 5.5
}
