{
  "id": "03923063-5834-4f56-aab5-c646a0e3c19b",
  "name": "Maicon Nunes",
  "aliases": [],
  "position": "DEF",
  "preferred_positions": [],
  "negative_positions": [],
  "permanent_keeper": false,
  "captain": false,
  "ability": "recreational",
  "vet": "veteran",
  "workrate": "steady",
  "rating_override": null,
  "fitness": "low",
  "profile": "Added 1 October 2026 with bands only; no notes yet on how he plays.",
  "created_at": "2026-10-01",
  "updated_at": "2026-10-01"
}
