{
  "id": "f0a1ec15-42b9-4031-b749-c8a769ade262",
  "name": "Josh Walker-Croft",
  "aliases": [
    "Josh"
  ],
  "position": "MID",
  "preferred_positions": [],
  "negative_positions": [],
  "permanent_keeper": false,
  "captain": false,
  "ability": "sunday_league",
  "vet": "none",
  "workrate": "steady",
  "rating_override": null,
  "fitness": "moderate",
  "profile": "Unknown quantity, entered as middle of the range across the board pending a proper look. Position a guess.",
  "created_at": "2026-10-29",
  "updated_at": "2026-10-29"
}
