{
  "id": "5f8fb8c9-4349-43bd-b32c-ebf707660319",
  "name": "Charlie Hall",
  "aliases": [],
  "position": "MID",
  "preferred_positions": [],
  "negative_positions": [],
  "permanent_keeper": false,
  "captain": false,
  "ability": "saturday",
  "vet": "none",
  "workrate": "steady",
  "rating_override": null,
  "fitness": "engine",
  "profile": "Young, around 16. Quality player who has played at academy level. Only real weakness is strength \u2014 can be knocked off the ball by bigger lads.",
  "created_at": "2026-10-26",
  "updated_at": "2026-10-26"
}
