{
  "id": "bc3e9361-9a5a-4d97-89ca-bb391a0e2250",
  "name": "David Potter",
  "aliases": [],
  "position": "DEF",
  "ability": "saturday",
  "vet": "none",
  "rating_override": null,
  "fitness": "good",
  "profile": "Plays Sunday vets league. Good left foot, strong and fast, good footballing brain.",
  "created_at": "2026-08-20",
  "updated_at": "2026-08-28",
  "preferred_positions": [
    "LB",
    "CB"
  ],
  "workrate": "grafter",
  "ability_value": 7.0,
  "fitness_value": 7.5,
  "workrate_value": 8.0
}
