{
  "id": "7a2e3699-2967-405f-b43a-d0d1b4813461",
  "name": "Steve B",
  "aliases": [],
  "position": "DEF",
  "ability": "sunday_league",
  "vet": "veteran",
  "rating_override": null,
  "fitness": "moderate",
  "profile": "Plays Sunday vets. Not a natural footballer, but solid at the back. Not the best with his feet, but always tries and puts in a shift to the best of his ability. Mediocre footballing brain.",
  "created_at": "2026-08-20",
  "updated_at": "2026-08-20",
  "preferred_positions": [
    "CB",
    "RB"
  ],
  "negative_positions": [
    "CAM",
    "ST"
  ],
  "workrate": "grafter",
  "ability_value": 5.5,
  "fitness_value": 6.0,
  "workrate_value": 6.0
}
