{
  "id": "22fe1c66-ade0-4d88-898f-eb7430a6c991",
  "name": "Hamza Hirsi",
  "aliases": [],
  "position": "MID",
  "preferred_positions": [
    "CAM",
    "ST",
    "RW"
  ],
  "negative_positions": [],
  "ability": "saturday",
  "vet": "none",
  "rating_override": null,
  "fitness": "moderate",
  "profile": "Quick feet, pace and strong. Good footballing brain, but can get frustrated. Good shot. More of an attacking player. A regular in this group for a while \u2014 he was only missing from these records until August 2026, so his history here starts later than his history with the lads.",
  "created_at": "2026-08-20",
  "updated_at": "2026-09-01",
  "workrate": "steady",
  "ability_value": 8.0,
  "fitness_value": 6.0,
  "workrate_value": 6.0
}
