{
  "id": "bf8b66bd-8a8f-42de-96e1-cfdfa1de8233",
  "name": "Joe Peacock",
  "aliases": [],
  "position": "MID",
  "preferred_positions": [],
  "negative_positions": [],
  "permanent_keeper": false,
  "captain": false,
  "ability": "saturday",
  "vet": "none",
  "workrate": "grafter",
  "rating_override": null,
  "fitness": "good",
  "profile": "Added 1 October 2026 with bands only; no notes yet on how he plays.",
  "created_at": "2026-10-01",
  "updated_at": "2026-10-01"
}
