{
  "id": "0e6c4ad1-0bb1-4012-b7ab-4bfe2f1895e6",
  "name": "Mat Baxter",
  "aliases": [],
  "position": "MID",
  "ability": "saturday",
  "vet": "none",
  "rating_override": null,
  "fitness": "engine",
  "profile": "Plays Sunday vets and playing a lot, so fitness is up. Good footballing brain, good all round, more defensive than attacking but will play anywhere needed. Performance scales with the players around him: with one or two other good footballing brains he is much better, and he generally cannot make something out of nothing on his own, he needs others moving.",
  "created_at": "2026-08-20",
  "updated_at": "2026-09-01",
  "preferred_positions": [
    "CDM",
    "CM",
    "CB"
  ],
  "workrate": "grafter",
  "ability_value": 7.5,
  "fitness_value": 9.5,
  "workrate_value": 7.25
}
