{
  "id": "249b547e-c470-429c-b48f-695390bfc482",
  "name": "Nathan Herbertson",
  "aliases": [],
  "position": "DEF",
  "ability": "saturday",
  "vet": "none",
  "rating_override": null,
  "fitness": "good",
  "profile": "Great defender. Always blocks a shot and is difficult to get past. Good footballing brain and good ability.",
  "created_at": "2026-08-20",
  "updated_at": "2026-09-01",
  "preferred_positions": [
    "CB"
  ],
  "negative_positions": [
    "ST"
  ],
  "workrate": "grafter",
  "ability_value": 6.0,
  "fitness_value": 8.0,
  "workrate_value": 7.5
}
