{
  "id": "740fc496-504e-4077-9a7e-af8a718439c5",
  "name": "Nick Bocks",
  "aliases": [],
  "position": "MID",
  "ability": "saturday",
  "vet": "none",
  "rating_override": null,
  "fitness": "good",
  "profile": "Plays Sunday vets. Good situational and positional awareness, very good footballing brain. Comfortable on the ball and keeps play simple.",
  "created_at": "2026-08-20",
  "updated_at": "2026-08-28",
  "preferred_positions": [
    "CM",
    "CDM"
  ],
  "workrate": "steady",
  "ability_value": 8.0,
  "fitness_value": 7.0,
  "workrate_value": 6.0
}
