{
  "id": "93e7f9d6-500b-4de2-9095-7e0ccbd9d6dc",
  "name": "Luke Basevi",
  "aliases": [],
  "position": "MID",
  "ability": "sunday_league",
  "vet": "none",
  "rating_override": null,
  "fitness": "engine",
  "profile": "Decent footballing brain, but holds onto the ball far too long and runs himself into trouble when a simple pass is on. Strong and extremely fit, always puts in a shift.",
  "created_at": "2026-08-20",
  "updated_at": "2026-09-01",
  "preferred_positions": [
    "CM",
    "RM"
  ],
  "workrate": "grafter",
  "ability_value": 6.0,
  "fitness_value": 9.5,
  "workrate_value": 7.0
}
